{
  "schemaVersion": "1.0.0",
  "kind": "app",
  "application": {
    "id": "com.tohseno.new-app",
    "name": "New App"
  },
  "platform": "ios",
  "composition": {
    "kernel": "ios-kernel",
    "template": "daily-game",
    "skills": [
      "daily-challenge",
      "local-progress",
      "rank-progression",
      "share-card"
    ]
  },
  "data": {
    "local": ["challenge results", "best score", "completed run count"],
    "remote": []
  },
  "storage": [
    {
      "id": "local-progress",
      "location": "UserDefaults",
      "content": "aggregate game progress"
    }
  ],
  "network": [],
  "identity": {
    "strategy": "none"
  },
  "entitlements": [],
  "integrations": [],
  "operations": {
    "project": "Shot.xcodeproj",
    "scheme": "Shot",
    "product": "Shot"
  },
  "privacy": {
    "rawIntentionTracked": false,
    "appContentLeavesDevice": false
  },
  "production": {
    "ready": false,
    "declarations": []
  },
  "irreversibleOperations": []
}
